Keyword,Intent,Volume,Trend,Keyword Difficulty,CPC (USD),Competitive Density,SERP Features,Number of Results
what is on olive garden's menu,Informational,320,"1.00,0.68,0.01,0.01,0.01,0.01,0.01,0.01,0.00,0.01,0.01,0.01",32,0.00,0.13,"Sitelinks, AI Overview, Image pack, Video, People also ask, Related searches, See results about",77900000
what is on the menu at olive garden,Informational,210,"1.00,0.16,0.05,0.06,0.03,0.06,0.05,0.05,0.10,0.06,0.06,0.05",50,1.06,0.14,"Sitelinks, AI Overview, Image pack, Video, People also ask, Discussions and forums, Related searches, See results about",79100000
what is the menu for olive garden,Informational,170,"1.00,0.06,0.01,0.00,0.01,0.01,0.04,0.01,0.01,0.02,0.03,0.01",52,0.95,0.21,"Sitelinks, AI Overview, Image pack, Video, People also ask, Related searches, See results about",141000000
what's the best thing on olive garden's menu,Commercial,170,"0.05,0.28,1.00,0.82,0.17,0.12,0.23,0.43,0.00,0.82,0.53,0.66",32,0.00,0.00,"Sitelinks, AI Overview, Image pack, Video, People also ask, Related searches, See results about",64000000
does olive garden have a gluten free menu,,140,"0.65,0.65,0.53,0.65,0.26,0.34,0.34,0.80,0.80,1.00,0.80,0.65",23,0.23,0.08,"Sitelinks, Image pack, Video, People also ask, Related searches",21100000
does olive garden have a lunch menu,"Informational, Transactional",140,"0.22,0.29,0.14,0.18,0.18,0.22,1.00,0.66,0.29,0.22,0.22,0.29",21,1.18,0.20,"Sitelinks, AI Overview, Reviews, Image pack, Video, People also ask, Related searches",33800000
what is olive garden's menu,Informational,140,"1.00,0.08,0.02,0.02,0.02,0.03,0.00,0.01,0.08,0.03,0.03,0.02",32,1.06,0.14,"Sitelinks, AI Overview, Reviews, Video, People also ask, Related searches, See results about",45800000
does olive garden restaurant have a gluten free menu,Informational,110,"0.53,0.53,0.43,0.53,0.33,0.53,0.43,0.53,0.19,0.43,1.00,0.66",23,0.23,0.08,"Sitelinks, AI Overview, Video, People also ask, Related searches",8280000
does olive garden have a senior menu,Informational,70,"0.42,0.33,0.52,1.00,0.42,0.19,0.33,0.19,0.33,0.19,0.33,0.23",17,0.51,0.06,"Sitelinks, AI Overview, Image pack, Video, People also ask, Related searches",78
does olive garden have a gluten-free menu,Informational,50,"0.63,0.81,0.81,0.81,1.00,0.18,0.18,0.45,0.00,0.09,1.00,0.00",26,0.00,0.00,"Sitelinks, AI Overview, Image pack, Video, People also ask, Related searches",32700000
does olive garden have gluten free menu,Informational,40,"0.70,0.70,0.70,0.70,0.70,0.70,1.00,0.00,0.00,0.56,0.56,0.70",22,0.23,0.08,"Sitelinks, AI Overview, Reviews, Image pack, Video, People also ask, Related searches",18100000
what's olive garden's menu,,30,"1.00,0.00,0.00,0.00,0.07,0.00,0.07,0.07,0.00,0.00,0.00,0.07",,0.00,0.33,,
a menu for olive garden,,20,"1.00,1.00,1.00,1.00,1.00,1.00,1.00,1.00,1.00,1.00,1.00,1.00",,0.93,0.20,,
can i have the menu for olive garden,,20,"1.00,1.00,1.00,1.00,1.00,1.00,1.00,1.00,1.00,1.00,1.00,1.00",,0.93,0.25,,
can i see the menu for olive garden,,20,"1.00,1.00,1.00,1.00,1.00,1.00,1.00,1.00,1.00,1.00,1.00,1.00",,0.00,0.16,,
can i see the olive garden menu,,20,"1.00,1.00,1.00,1.00,1.00,1.00,1.00,1.00,1.00,1.00,1.00,1.00",,0.00,0.21,,
did olive garden change their menu,,20,"1.00,1.00,1.00,1.00,1.00,1.00,1.00,1.00,1.00,1.00,1.00,1.00",,0.00,0.00,,
does olive garden have a healthy menu,,20,"1.00,1.00,1.00,1.00,1.00,1.00,1.00,1.00,1.00,1.00,1.00,1.00",,0.00,0.12,,
does olive garden have a keto menu,,20,"1.00,1.00,1.00,1.00,1.00,1.00,1.00,1.00,1.00,1.00,1.00,1.00",,0.00,0.09,,
does olive garden have a light menu,,20,"1.00,1.00,1.00,1.00,1.00,1.00,1.00,1.00,1.00,1.00,1.00,1.00",,0.00,0.17,,
does olive garden have a low sodium menu,,20,"1.00,1.00,1.00,1.00,1.00,1.00,1.00,1.00,1.00,1.00,1.00,1.00",,0.00,0.05,,
does olive garden have a lunch menu on weekends,,20,"1.00,1.00,1.00,1.00,1.00,1.00,1.00,1.00,1.00,1.00,1.00,1.00",,0.00,0.18,,
does olive garden have a secret menu,,20,"0.00,0.00,0.00,0.00,0.00,0.00,0.00,0.00,0.00,0.00,0.00,0.00",,0.00,0.00,,
does olive garden have a take out menu,,20,"1.00,1.00,1.00,1.00,1.00,1.00,1.00,1.00,1.00,1.00,1.00,1.00",,0.00,0.29,,
does olive garden have a vegan menu,,20,"1.00,1.00,1.00,1.00,1.00,1.00,1.00,1.00,1.00,1.00,1.00,1.00",,0.00,0.05,,
does olive garden have a vegetarian menu,,20,"1.00,1.00,1.00,1.00,0.00,0.00,0.00,1.00,1.00,1.00,1.00,1.00",,0.00,0.05,,
does olive garden have gluten free menu items,,20,"1.00,1.00,1.00,0.00,1.00,1.00,1.00,1.00,1.00,1.00,1.00,1.00",,0.00,0.05,,
does olive garden have lunch menu,,20,"1.00,1.00,1.00,1.00,1.00,1.00,1.00,1.00,1.00,1.00,1.00,1.00",,1.36,0.19,,
does olive garden have lunch menu on saturday,,20,"1.00,1.00,1.00,1.00,1.00,1.00,1.00,1.00,1.00,1.00,1.00,1.00",,0.00,0.14,,
does olive garden have lunch menu on weekends,,20,"1.00,1.00,1.00,1.00,1.00,1.00,1.00,1.00,1.00,1.00,1.00,1.00",,0.61,0.10,,
does olive garden have pizza on the menu,,20,"1.00,1.00,1.00,1.00,1.00,1.00,1.00,1.00,1.00,1.00,1.00,1.00",,0.00,0.00,,
does olive garden have pizza on the menu with prices,,20,"1.00,1.00,1.00,1.00,1.00,1.00,1.00,1.00,1.00,1.00,1.00,1.00",,0.00,0.00,,
does olive garden have pizza on their menu,,20,"1.00,1.00,1.00,1.00,1.00,1.00,1.00,1.00,1.00,1.00,1.00,1.00",,0.00,0.00,,
does olive garden have senior menu,,20,"1.00,1.00,1.00,1.00,1.00,1.00,1.00,1.00,1.00,1.00,1.00,1.00",,0.00,0.14,,
does olive garden have steak on the menu,,20,"1.00,1.00,1.00,1.00,1.00,1.00,1.00,1.00,1.00,1.00,1.00,1.00",,0.40,0.10,,
does olive garden have steak on their menu,,20,"1.00,1.00,1.00,1.00,1.00,1.00,1.00,1.00,1.00,1.00,1.00,1.00",,0.40,0.10,,
does olive garden have vegan menu,,20,"1.00,1.00,1.00,1.00,1.00,1.00,1.00,1.00,1.00,1.00,1.00,1.00",,0.00,0.00,,
does olive garden menu,,20,"1.00,1.00,1.00,1.00,1.00,1.00,1.00,1.00,1.00,1.00,1.00,1.00",,0.51,0.21,,
does olive garden offer lunch menu on weekends,,20,"1.00,1.00,1.00,1.00,1.00,1.00,1.00,1.00,1.00,1.00,1.00,1.00",,0.00,0.11,,
how long is lunch menu at olive garden,,20,"1.00,0.00,0.00,1.00,1.00,1.00,1.00,1.00,1.00,1.00,1.00,1.00",,0.00,0.07,,
how many calories in olive garden menu,,20,"1.00,1.00,1.00,1.00,1.00,1.00,1.00,1.00,1.00,1.00,1.00,0.00",,0.00,0.00,,
how much does the entire olive garden menu cost,,20,"1.00,1.00,1.00,1.00,1.00,1.00,1.00,1.00,1.00,1.00,1.00,1.00",,0.00,0.00,,
how much is olive garden menu,,20,"1.00,1.00,1.00,1.00,1.00,1.00,1.00,1.00,1.00,1.00,1.00,1.00",,0.00,0.12,,
how to memorize olive garden menu,,20,"1.00,1.00,1.00,1.00,0.00,0.00,1.00,1.00,1.00,1.00,1.00,1.00",,0.00,0.00,,
what can i eat at olive garden on optavia menu,,20,"0.00,0.00,1.00,1.00,1.00,1.00,1.00,1.00,1.00,1.00,1.00,1.00",,0.00,0.00,,
what is gluten free at olive garden menu,,20,"1.00,1.00,1.00,1.00,1.00,1.00,1.00,1.00,1.00,1.00,1.00,1.00",,0.00,0.05,,
what is the lunch menu at olive garden,,20,"1.00,1.00,1.00,1.00,1.00,1.00,1.00,1.00,1.00,1.00,1.00,1.00",,1.02,0.29,,
what is the veterans day menu at olive garden,,20,"0.00,0.00,0.00,0.18,1.00,0.00,0.00,0.00,0.00,0.18,0.18,0.00",,0.00,0.00,,
what time does lunch menu end at olive garden,,20,"1.00,1.00,1.00,1.00,1.00,1.00,1.00,1.00,1.00,1.00,1.00,1.00",,0.00,0.08,,
what time does olive garden lunch menu end,,20,"1.00,1.00,1.00,1.00,1.00,1.00,1.00,1.00,1.00,1.00,1.00,1.00",,0.96,0.15,,
what time does the lunch menu end at olive garden,,20,"1.00,1.00,1.00,1.00,1.00,1.00,1.00,1.00,1.00,1.00,1.00,1.00",,0.96,0.15,,
what time is lunch menu at olive garden,,20,"1.00,1.00,1.00,1.00,1.00,1.00,1.00,1.00,1.00,1.00,1.00,1.00",,0.00,0.14,,
what time is olive garden lunch menu,,20,"1.00,1.00,1.00,1.00,1.00,1.00,1.00,1.00,1.00,1.00,1.00,1.00",,0.92,0.13,,
what's on the menu at olive garden,,20,"1.00,1.00,1.00,1.00,1.00,1.00,1.00,1.00,0.00,1.00,1.00,1.00",,1.34,0.23,,
what's the menu at olive garden,,20,"1.00,1.00,1.00,1.00,1.00,1.00,1.00,1.00,0.00,1.00,1.00,1.00",,1.49,0.21,,
what's the menu for olive garden,,20,"1.00,1.00,1.00,1.00,1.00,1.00,1.00,1.00,0.00,1.00,1.00,1.00",,1.34,0.23,,
why did olive garden change their menu,,20,"1.00,1.00,1.00,1.00,1.00,1.00,1.00,1.00,0.00,1.00,0.00,0.00",,0.00,0.00,,
does olive garden have low carb menu,,10,"0.00,0.00,1.00,0.00,1.00,1.00,0.00,1.00,0.00,1.00,1.00,1.00",,0.00,0.05,,
what is a sloppy mario at olive garden menu,,10,"0.00,0.00,1.00,0.18,0.00,0.00,0.00,0.18,0.00,0.00,0.00,0.00",,0.00,0.00,,
what is gluten-free at olive garden menu,,10,"0.00,1.00,1.00,1.00,0.00,0.00,0.00,0.00,0.00,0.00,0.00,0.00",,0.00,0.00,,
what is on the olive garden veterans day menu,,10,"0.00,0.00,0.00,0.00,1.00,0.00,0.00,0.40,0.00,0.00,0.00,0.00",,0.00,0.00,,
a printable olive garden menu,,0,"0.00,0.00,0.00,0.00,0.00,0.00,0.00,0.00,0.00,0.00,0.00,0.00",,0.00,0.00,,
can adults order from the children's menu at olive garden,,0,"0.00,0.00,0.00,0.00,0.00,0.00,0.00,0.00,0.00,0.00,0.00,0.00",,0.00,0.00,,
can i order from the kids menu at olive garden,,0,"0.00,0.00,0.00,0.00,0.00,0.00,0.00,0.00,0.00,0.00,0.00,0.00",,0.00,0.00,,
can i order off olive garden dinner menu at lunch,,0,"0.00,0.00,0.00,0.00,0.00,0.00,0.00,0.00,0.00,0.00,0.00,0.00",,0.00,0.00,,
did olive garden change their menu 2020,,0,"0.00,0.00,0.00,0.00,0.00,0.00,0.00,0.00,0.00,0.00,0.00,0.00",,0.00,0.00,,
did olive garden remove chicken meatballs from their menu,,0,"0.00,0.00,0.00,0.00,0.00,0.00,0.00,0.00,0.00,0.00,0.00,0.00",,0.00,0.00,,
did olive garden take steak gorgonzola off the menu,,0,"0.00,0.00,0.00,0.00,0.00,0.00,0.00,0.00,0.00,0.00,0.00,0.00",,0.00,0.00,,
does olive garden apricot chicken on menu,,0,"0.00,0.00,0.00,0.00,0.00,0.00,0.00,0.00,0.00,0.00,0.00,0.00",,0.00,0.00,,
does olive garden have 2 for 12.99 menu,,0,"0.00,0.00,0.00,0.00,0.00,0.00,0.00,0.00,0.00,0.00,0.00,0.00",,0.00,0.00,,
does olive garden have a carry out menu,,0,"0.00,0.00,0.00,0.00,0.00,0.00,0.00,0.00,0.00,0.00,0.00,0.00",,0.00,0.00,,
does olive garden have a children's menu,,0,"0.00,0.00,0.00,0.00,0.00,0.00,0.00,0.00,0.00,0.00,0.00,0.00",,0.00,0.00,,
does olive garden have a diabetic menu,,0,"0.00,0.00,0.00,0.00,0.00,0.00,0.00,0.00,0.00,0.00,0.00,0.00",,0.00,0.00,,
does olive garden have a diet menu,,0,"0.00,0.00,0.00,0.00,0.00,0.00,0.00,0.00,0.00,0.00,0.00,0.00",,0.00,0.00,,
does olive garden have a kids menu,,0,"0.00,0.00,0.00,0.00,0.00,0.00,0.00,0.00,0.00,0.00,0.00,0.00",,0.00,0.00,,
does olive garden have a limited menu right now,,0,"0.00,0.00,0.00,0.00,0.00,0.00,0.00,0.00,0.00,0.00,0.00,0.00",,0.00,0.00,,
does olive garden have a lite menu,,0,"0.00,0.00,0.00,0.00,0.00,0.00,0.00,0.00,0.00,0.00,0.00,0.00",,0.00,0.00,,
does olive garden have a low carb menu,,0,"0.00,0.00,0.00,0.00,0.00,0.00,0.00,0.00,0.00,0.00,0.00,0.00",,0.00,0.00,,
does olive garden have a low fat menu,,0,"0.00,0.00,0.00,0.00,0.00,0.00,0.00,0.00,0.00,0.00,0.00,0.00",,0.00,0.00,,
does olive garden have a senior citizens menu,,0,"0.00,0.00,0.00,0.00,0.00,0.00,0.00,0.00,0.00,0.00,0.00,0.00",,0.00,0.00,,
does olive garden have a senior menu with prices,,0,"0.00,0.00,1.00,0.00,0.00,0.00,0.00,0.00,0.00",,0.00,0.00,,
does olive garden have a seniors menu,,0,"0.00,0.00,0.00,0.00,0.00,0.00,0.00,0.00,0.00,0.00,0.00,0.00",,0.00,0.00,,
does olive garden have a special menu for rehearsal dinners,,0,"0.00,0.00,0.00,0.00,0.00,0.00,0.00,0.00,0.00,0.00,0.00,0.00",,0.00,0.00,,
does olive garden have fish on the menu,,0,"1.00,0.00,0.00,0.00",,0.00,0.00,,
does olive garden have kids menu,,0,"0.00,0.00,0.00,0.00,0.00,0.00,0.00,0.00,0.00,0.00,0.00,0.00",,0.00,0.00,,
does olive garden have low calorie menu,,0,"0.00,0.00,0.00,0.00,0.00,0.00,0.00,0.00,0.00,0.00,0.00,0.00",,0.00,0.00,,
does olive garden have lunch menu weekends,,0,"0.00,0.00,0.00,0.00,0.00,0.00,0.00,0.00,0.00,0.00,0.00,0.00",,0.00,0.00,,
does olive garden have salmon on the menu,,0,"0.00,0.00,0.00,0.00,0.00,0.00,0.00,0.00,0.00,0.00,0.00,0.00",,0.00,0.00,,
does olive garden kids menu come with breadsticks,,0,"0.00,0.00,0.00,0.00,0.00,0.00,0.00,0.00,0.00,0.00,0.00,0.00",,0.00,0.00,,
does olive garden menu show carbs,,0,"0.00,0.00,0.00,0.00,0.00,0.00,0.00,0.00,0.00,0.00,0.00,0.00",,0.00,0.00,,
does olive garden offer a gluten free menu,,0,"0.00,0.00,0.00,0.00,0.00,0.00,0.00,0.00,0.00,0.00,0.00,0.00",,0.00,0.00,,
does olive garden offer a gluten free menue,,0,"0.00,0.00,0.00,0.00,0.00,0.00,0.00,0.00,0.00,0.00,0.00,0.00",,0.00,0.00,,
does olive garden offer gluten free menu,,0,"0.00,0.00,0.00,0.00,0.00,0.00,0.00,0.00,0.00,0.00,0.00,0.00",,0.00,0.00,,
does olive garden offer gluten free menu items,,0,"0.00,0.00,0.00,0.00,0.00,0.00,0.00,0.00,0.00,0.00,0.00,0.00",,0.00,0.00,,
does olive.garden have kids menu,,0,"0.00,0.00,0.00,0.00,0.00,0.00,0.00,0.00,0.00,0.00,0.00,0.00",,0.00,0.00,,
does the olive garden lunch menu count on labor day,,0,"0.00,0.00,0.00,0.00,0.00,0.00,0.00,0.00,0.00,0.00,0.00,0.00",,0.00,0.00,,
does the olive garden lunch menu include soup or salad,,0,"0.00,0.00,0.00,0.00,0.00,0.00,0.00,0.00,0.00,0.00,0.00,0.00",,0.00,0.00,,
how hard is the olive garden menu test,,0,"0.00,0.00,0.00,0.00,0.00,0.00,0.00,0.00,0.00,0.00,0.00,0.00",,0.00,0.00,,
how many items are on the olive garden menu,,0,"0.00,0.00",,0.00,0.00,,
how much does olive garden entire menu cost,,0,"0.00,0.00,0.00,0.00,0.00,0.00,0.00,0.00,0.00,0.00,0.00,0.00",,0.00,0.00,,
how much is the lunch menu at olive garden,,0,"0.00,0.00,0.00,0.00,0.00,0.00,0.00,0.00,0.00,0.00,0.00,0.00",,0.00,0.00,,
how olive garden menu,,0,"0.00,0.00,0.00,0.00,0.00,0.00,0.00,0.00,0.00,0.00,0.00,0.00",,0.00,0.00,,
how olive garden's menu has changed over the years,,0,"0.00,0.00,1.00,0.00,0.00,0.00,0.00,0.00,0.00,0.00,0.00,0.00",,0.00,0.00,,
how the menu at olive garden is set up,,0,"0.00,0.00,0.00,0.00,0.00,0.00,0.00,0.00,0.00,0.00,0.00,0.00",,0.00,0.00,,
how to pass the olive garden menu assessment,,0,"0.00,0.00,0.00,0.00,0.00,0.00,0.00,0.00,0.00,0.00,0.00,0.00",,0.00,0.00,,
how to study for olive garden menu test,,0,"0.00,0.00,0.00,0.00,0.00,0.00,0.00,0.00,0.00,0.00,0.00,0.00",,0.00,0.00,,
is beef torteloni still on olive garden menu,,0,"0.00,0.00,0.00,0.00,0.00,0.00,0.00,0.00,0.00,0.00,0.00,0.00",,0.00,0.00,,
is braised beef torteloni still on olive garden menu,,0,"0.00,0.00,0.00,0.00,0.00,0.00,0.00,0.00,0.00,0.00,0.00,0.00",,0.00,0.00,,
is olive garden menu,,0,"0.00,0.00,0.00,0.00,0.00,0.00,0.00,0.00,0.00,0.00,0.00,0.00",,0.92,0.22,,
is olive garden serving a limited menu,,0,"0.00,0.00,0.00,0.00,0.00,0.00,0.00,0.00,0.00,0.00,0.00,0.00",,0.00,0.00,,
is shrimp scampi on olive garden lunch duo menu,,0,"0.00,0.00,0.00,0.00,0.00,0.00,0.00,0.00,0.00,0.00,0.00,0.00",,0.00,0.00,,
is there a gluten free menu at olive garden,,0,"0.00,0.00,0.00,0.00,0.00,0.00,0.00,0.00,0.00,0.00,0.00,0.00",,0.00,0.00,,
is there a lunch menu at olive garden liberty mo,,0,"0.00,0.00,0.00,0.00,0.00,0.00,0.00,0.00,0.00,0.00,0.00,0.00",,0.00,0.00,,
what does buy one take one at olive garden menu,,0,"0.00,0.00,0.00,0.00,0.00,0.00,0.00,0.00,0.00,0.00,0.00,0.00",,0.00,0.00,,
what does olive garden menu look like,,0,"0.00,0.00,0.00,0.00,0.00,0.00,0.00,0.00,0.00,0.00,0.00,0.00",,0.00,0.00,,
what does the name olive garden menu,,0,"0.00,0.00,0.00,0.00,0.00,0.00,0.00,0.00,0.00,0.00,0.00,0.00",,0.00,0.00,,
what is eary dinner menu in olive garden,,0,"0.00,0.00,0.00,0.00,0.00,0.00,0.00,0.00,0.00,0.00,0.00,0.00",,0.00,0.00,,
what is olive garden menu,,0,"0.00,0.00,0.00,0.00,0.00,0.00,0.00,0.00,0.00,0.00,0.00,0.00",,0.95,0.21,,
what is olive garden pasta menu,,0,"0.00,0.00,0.00,0.00,0.00,0.00,0.00,0.00,0.00,0.00,0.00,0.00",,0.00,0.00,,
what is olive garden special menu for veterans day,,0,"0.00,0.00,0.00,0.00,1.00,0.00,0.00,0.00,0.00,0.00,0.00,0.00",,0.00,0.00,,
what is olive garden's menu for veterans day,,0,"0.00,0.00,0.00,0.00,0.00,0.00,0.00,0.00,0.00,0.00,0.00,0.00",,0.00,0.00,,
what is on olive garden's dinner duo menu,,0,"0.00,0.00,0.00,0.00,0.00,0.00,0.00,0.00,0.00,0.00,0.00,0.00",,0.00,0.00,,
what is on the menue at olive garden,,0,"0.00,0.00,0.00,0.00,0.00,0.00,0.00,0.00,0.00,0.00,0.00,0.00",,0.00,0.00,,
what is on the olive garden lunch menu,,0,"0.00,0.00,0.00,0.00,0.00,0.00,0.00,0.00,0.00,0.00,0.00,0.00",,0.00,0.00,,
what is on the olive garden menu,,0,"0.00,0.00,0.00,0.00,0.00,0.00,0.00,0.00,1.00,1.00,0.00,0.00",,0.95,0.21,,
what is on the olive garden menu test,,0,"0.00,0.00,0.00,0.00,0.00,0.00,0.00,0.00,0.00,0.00,0.00,0.00",,0.00,0.00,,
what is the children's menu of olive garden,,0,"0.00,0.00,0.00,0.00,0.00,0.00,0.00,0.00,0.00,0.00,0.00,0.00",,0.00,0.00,,
what is the dessert menu for olive garden,,0,"0.00,0.00,0.00,0.00,0.00,0.00,0.00,0.00,0.00,0.00,0.00,0.00",,0.00,0.00,,
what is the healthiest item on menu at olive garden,,0,"0.00,0.00,0.00,0.00,0.00,0.00,0.00,0.00,0.00,0.00,0.00,0.00",,0.00,0.00,,
what is the lunch menu and prices at olive garden,,0,"0.00,0.00,0.00,0.00,0.00,0.00,0.00,0.00,0.00,0.00,0.00,0.00",,0.00,0.00,,
what is the menu at olive garden,,0,"0.00,0.00,0.00,0.00,0.00,0.00,1.00,0.00,0.00,0.00,0.00,0.00",,0.95,0.21,,
what is the olive garden dinner menu,,0,"0.00,0.00,0.00,0.00,0.00,0.00,0.00,0.00,0.00,0.00,0.00,0.00",,0.00,0.00,,
what is the olive garden menu,,0,"1.00,0.00,0.00,0.00,0.00,0.00,0.00,0.00,0.00,0.00,0.00,0.00",,0.95,0.21,,
what is the olive garden menu for veterans day 2016,,0,"0.00,0.00,0.00,0.00,0.00,0.00,0.00,0.00,0.00,0.00,0.00,0.00",,0.00,0.00,,
what is the olive garden menu near me,,0,"0.00,0.00,0.00,0.00,0.00,0.00,0.00,0.00,0.00,0.00,0.00,0.00",,0.00,0.00,,
what is the special menu for veterans at olive garden,,0,"0.00,0.00,0.00,0.00,1.00,0.00,0.00,0.00,0.00,0.00,0.00,0.00",,0.00,0.00,,
what is the veterans day menu for olive garden,,0,"0.00,0.00,0.00,0.00,0.00,0.00,0.00,0.00,0.00,0.00,0.00,0.00",,0.00,0.00,,
what time does dinner menu start at olive garden,,0,"0.00,0.00,0.00,0.00,0.00,0.00,0.00,0.00,0.00,0.00,0.00,0.00",,0.00,0.00,,
what time does olive garden lunch menu rnd,,0,"0.00,0.00,0.00,0.00,0.00,0.00,0.00,0.00,0.00,0.00,0.00,0.00",,0.00,0.00,,
what time does olive garden swithch to dinner menu,,0,"0.00,0.00,0.00,0.00,0.00,0.00,0.00,0.00,0.00,0.00,0.00,0.00",,0.00,0.00,,
what time is olive garden's lunch menu,,0,"0.00,0.00,0.00,1.00,0.00,0.00,0.00,0.00,0.00,0.00,0.00,0.00",,0.92,0.13,,
what time is the lunch menu at olive garden,,0,"0.00,0.00,0.00,1.00,0.00,0.00,0.00,0.00,0.00,0.00,0.00,0.00",,0.83,0.12,,
what time is the lunch menu over at olive garden,,0,"0.00,0.00,0.00,0.00,0.00,0.00,0.00,0.00,0.00,0.00,0.00,0.00",,0.00,0.00,,
what type of menu is olive garden,,0,"0.00,0.00,0.00,0.00,0.00,0.00,0.00,0.00,0.00,0.00,0.00,0.00",,0.00,0.00,,
what's new in olive garden menu,,0,"0.00,0.00,0.00,0.00,0.00,0.00,0.00,0.00,0.00,0.00,0.00,0.00",,0.00,0.00,,
what's new on olive garden's menu,,0,"0.00,0.00,0.00,0.00,0.00,0.00,0.00,0.00,0.00,0.00,0.00,0.00",,0.00,0.00,,
what's on the menu for the olive garden,,0,"0.00,0.00,0.00,0.00,0.00,0.00,0.00,0.00,0.00,0.00,0.00,0.00",,0.00,0.00,,
what's on the olive garden menu,,0,"0.00,0.00,0.00,0.00,0.00,0.00,0.00,0.00,0.00,0.00,0.00,0.00",,1.34,0.23,,
when can i get llunch menu at olive garden,,0,"0.00,0.00,0.00,0.00,0.00,0.00,0.00,0.00,0.00,0.00,0.00,0.00",,0.00,0.00,,
when does dinner menu start at olive garden,,0,"0.00,0.00,0.00,0.00,0.00,0.00,0.00,0.00,0.00,0.00,0.00,0.00",,0.00,0.00,,
when does lunch menu end at olive garden,,0,"0.00,0.00,0.00,0.00,0.00,0.00,0.00,0.00,0.00,0.00,0.00,0.00",,0.00,0.00,,
when does the dinner menu start at olive garden,,0,"0.00,0.00,0.00,0.00,0.00,0.00,0.00,0.00,0.00,0.00,0.00,0.00",,0.00,0.00,,
when does the lunch menu end at olive garden,,0,"0.00,0.00,0.00,0.00,0.00,0.00,0.00,0.00,0.00,0.00,0.00,0.00",,0.00,0.00,,
when is the lunch menu at olive garden,,0,"0.00,0.00,0.00,0.00,0.00,0.00,0.00,0.00,0.00,0.00,0.00,0.00",,0.00,0.00,,
when lunch menu olive garden,,0,"0.00,0.00,0.00,0.00,0.00,0.00,0.00,0.00,0.00,0.00,0.00,0.00",,0.00,0.00,,
when will olive garden bring back full menu,,0,"0.00,0.00,0.00,0.00,0.00,0.00,0.00,0.00,0.00,0.00,0.00,0.00",,0.00,0.00,,
where is a staircase located olive garden menu,,0,"0.00,0.00,0.00,0.00,0.00,0.00,0.00,0.00,0.00,0.00,0.00,0.00",,0.00,0.00,,
why did olive garden remove sandwiches from menu,,0,"0.00,0.00,0.00,0.00,0.00,0.00,0.00,0.00,0.00,0.00,0.00,0.00",,0.00,0.00,,
why did olive garden take pizza off the menu,,0,"0.00,0.00,0.00,0.00,0.00,0.00,0.00,0.00,0.00,0.00,0.00,0.00",,0.00,0.00,,
why doesn't olive garden list their dinner menu prices,,0,"0.00,0.00,0.00,0.00,0.00,0.00,0.00,0.00,0.00,0.00,0.00,0.00",,0.00,0.00,,
